"dr909","South Coast Survey","10.15468/fyngz8","South Coast Survey. NatureMap: Mapping Western Australia's Biodiversity. Department of Environment and Conservation. URL: http://naturemap.dec.wa.gov.au/","Creative Commons Attribution (International) (CC-BY 4.0 (Int)) Conditions of Access

All users need to acknowledge and agree to the following conditions before using NatureMap content:

Data within NatureMap is provided with the participation and good will of data custodians and I will endeavour, where possible, to seek a collaborative approach with custodians in any research or papers published using NatureMap data.

Re-sale of raw data or the commercial use of images or descriptive text (other than generated maps, species lists and reports) on this site is unauthorised unless written permission is obtained from the Department of Environment and Conservation (DEC).

Appropriate and full acknowledgement of DEC and species data custodians (see Data Directory) must always be given in any publication that includes data sourced here.

Data provided through NatureMap represents positive records of flora and fauna occurrence. The absence of a record should not be taken to mean flora or fauna is necessarily absent from an area. (To minimise the effect of data gaps, a buffer area should be applied that is reflective of the likelihood of surveys or collections having been undertaken in the target area.)

My username and password will not be passed on to any other person or organisation.

DEC and data custodians reserve the right to revoke registration if the above conditions of access are not complied with.

I will notify DEC if any relevant conditions change that might affect my NatureMap authorisation level.

Also note:

Custodians have kindly granted permission to allow relatively large subsets of data to be downloaded for a wide range of uses, including within a commercial context. Note, however, it is not NatureMap policy to allow the downloading of entire datasets

It is current custodian policy to only grant Advanced Access (see the Registration page) for bona fide research or conservation planning purposes. This does not extend to use within a commercial context. While this may appear restrictive, in fact basic registration provides a great deal of information on both conservation and non-conservation taxa, and all users are encouraged to explore NatureMap's sophisticated querying and mapping capabilities. DEC's Species and Communities Branch continues to provide information on detailed localities of conservation taxa to consultants and other commercial users on a fee-for-service basis.

Fair Use Guidlines

As stated above, we want as many people as possible to make use of the data available within NatureMap, so long as that use is ""fair"". It is considered fair for anyone to use information from NatureMap for conservation or planning purposes, including incorporating that information into reports or papers, or summarising and value-adding to data.

It is not considered fair use to download raw data and on-sell it. That would contravene copyright. It is also bad business, because anyone could obtain the same data directly from NatureMap.

Of particular note:

Maps, species lists, reports and raw data may be freely used by anyone, including commercial consultants, for research, planning, generating reports and compilations, or for personal use, so long as the above conditions of access are complied with.

Raw data, i.e. bulk detail records of individual locations that have been downloaded from NatureMap and not summarised, compiled or modified in any substantial way, may not be on-sold or rebadged without written permission from the Department of Environment and Conservation (DEC). This is consistent with Australian Copyright law.

Other descriptive text and images, such as Thematic content on wetlands or ecological attributes, remain the property of NatureMap and copyright holders and may not be used without written permission from DEC.

For full terms of use see Copyright page at

http://naturemap.dec.wa.gov.au/default.aspx","For more information: https://collections.ala.org.au/public/show/dr909","","","","219"
"dr1010","ClimateWatch","10.15468/xlx9o4","Data accessed from ClimateWatch can be cited in the following format:
ClimateWatch <YEAR> <SPECIES> <START DATE> - <END DATE> 
Data set accessed <DATE> http://www.climatewatch.org.au.","Creative Commons Attribution (International) (CC-BY 3.0 (Int))","For more information: https://collections.ala.org.au/public/show/dr1010","","","","130"
"dr22131","Brisbane Botanic Gardens","10.15468/w25vrn","Records provided by Brisbane Botanic Gardens, accessed through ALA website.","Creative Commons Attribution (Australia) (CC-BY 3.0 (Au)) Creative Commons Attribution (Australia) (CC-BY 3.0 (Au) 3.0) 
        Creative Commons Attribution (Australia) (CC-BY 3.0 (Au) 3.0) 
        Creative Commons Attribution (Australia) (CC-BY 3.0 (Au) 3.0) 
        Creative Commons Attribution (Australia) (CC-BY 3.0 (Au) 3.0)","For more information: https://collections.ala.org.au/public/show/dr22131","","","","4"
"dr1132","WildNet - Queensland Wildlife Data","10.15468/lxgoyb","Queensland Government","Creative Commons Attribution (International) (CC-BY 4.0 (Int))","For more information: https://collections.ala.org.au/public/show/dr1132","","","","30"
"dr344","Queensland Museum provider for OZCAM","10.15468/lotsye","Queensland Museum, http://www.qm.qld.gov.au/","CC-BY","For more information: https://collections.ala.org.au/public/show/dr344","","","","24"
"dr345","Queen Victoria Museum Art Gallery provider for OZCAM","10.15468/tedfxn","Queen Victoria Museum and Art Gallery, http://www.qvmag.tas.gov.au/","Creative Commons Attribution-Noncommercial (International) (CC-BY-NC 4.0 (Int)) Queen Victoria Museum and Art Gallery, http://www.qvmag.tas.gov.au/ Queen Victoria Museum and Art Gallery, http://www.qvmag.tas.gov.au/ 
        Creative Commons Attribution-Noncommercial (International) (CC-BY-NC 4.0 (Int) 4.0)","For more information: https://collections.ala.org.au/public/show/dr345","","","","1"
"dr340","Australian Museum provider for OZCAM","10.15468/e7susi","Records provided by Australian Museum provider for OZCAM, accessed through ALA website.","Creative Commons Attribution (Australia) (CC-BY 3.0 (Au)) Australian Museum, http://australianmuseum.net.au/ Creative Commons Attribution (Australia) (CC-BY 3.0 (Au) 3.0)","For more information: https://collections.ala.org.au/public/show/dr340","","","","2"
"dr30675","University of British Columbia Herbarium (UBC) - Vascular Plant Collection","10.5886/rtt57cc9","doi:10.5886/rtt57cc9","Creative Commons Zero (CC0)","For more information: https://collections.ala.org.au/public/show/dr30675","","","","42"
"dr30434","United Herbaria of the University and ETH Zurich","10.15468/tjvqci","Nyffeler R, Guggisberg A (2025). United Herbaria of the University and ETH Zurich. Version 1.1379. United Herbaria of the University and ETH Zurich (Z+ZT). Occurrence dataset https://doi.org/10.15468/tjvqci accessed via GBIF.org on 2025-02-24.","CC BY","For more information: https://collections.ala.org.au/public/show/dr30434","","","","4"
"dr30430","The University and Jepson Herbaria -- Vascular Plants","10.15468/nmny7h","Alexander J, Gross J (2024). The University and Jepson Herbaria -- Vascular Plants. Version 1.9. Berkeley Natural History Museums. Occurrence dataset https://doi.org/10.15468/nmny7h accessed via GBIF.org on 2025-02-24.","CC BY-NC","For more information: https://collections.ala.org.au/public/show/dr30430","","","","223"
"dr23109","South Australian Seed Conservation Centre","","Records provided by South Australian Seed Conservation Centre, accessed through ALA website.","Creative Commons Attribution (Australia) (CC-BY 3.0 (Au)) Creative Commons Attribution (Australia) (CC-BY 3.0 (Au) 3.0) 
        Creative Commons Attribution (Australia) (CC-BY 3.0 (Au) 3.0) 
        Creative Commons Attribution (Australia) (CC-BY 3.0 (Au) 3.0)","For more information: https://collections.ala.org.au/public/show/dr23109","","","","763"
"dr9662","Brisbane City Council","10.15468/ljfjwq","Brisbane City Council (https://www.brisbane.qld.gov.au/)","Creative Commons Attribution (Australia) (CC-BY 3.0 (Au))","For more information: https://collections.ala.org.au/public/show/dr9662","","","","61"
"dp2048","ClimateWatch","","Records provided by ClimateWatch, accessed through ALA website.","","For more information: https://collections.ala.org.au/public/show/dp2048","","","","130"
"dr2592","Logan City Council Species Sightings","10.15468/pxqupc","Records provided by Logan City Council Species Sightings, accessed through ALA website.","Logan City Council, Queensland","For more information: https://collections.ala.org.au/public/show/dr2592","","","","3"
"in118","Massey University","","Records provided by Massey University, accessed through ALA website.","","For more information: https://collections.ala.org.au/public/show/in118","","","","93"
"in115","Lincoln University","","Records provided by Lincoln University, accessed through ALA website.","","For more information: https://collections.ala.org.au/public/show/in115","","","","266"
"dr8212","Conservation Atlas Surveys","10.15468/yoxxna","Specht A., Bolton M.P., Kingsford B., Specht R.L., Belbin L. (2018) A story of data won, data lost and data re-found: the realities of ecological data preservation. Biodiversity Data Journal 6:e28073. doi: 10.3897/BDJ.6.e28073","Creative Commons Attribution (Australia) (CC-BY 3.0 (Au))","For more information: https://collections.ala.org.au/public/show/dr8212","None.","None","","2070"
"in119","Scion","","Records provided by Scion, accessed through ALA website.","","For more information: https://collections.ala.org.au/public/show/in119","","","","594"
"co147","Queensland Museum Molluscs","","Records provided by Queensland Museum Molluscs, accessed through ALA website.","","For more information: https://collections.ala.org.au/public/show/co147","","","","24"
"dr23110","Australian PlantBank","10.15468/966wqr","Records provided by Australian PlantBank, accessed through ALA website.","Creative Commons Attribution (Australia) (CC-BY 3.0 (Au)) Creative Commons Attribution (Australia) (CC-BY 3.0 (Au) 3.0) 
        Creative Commons Attribution (Australia) (CC-BY 3.0 (Au) 3.0) 
        Creative Commons Attribution (Australia) (CC-BY 3.0 (Au) 3.0) 
        Creative Commons Attribution (Australia) (CC-BY 3.0 (Au) 3.0) 
        Creative Commons Attribution (Australia) (CC-BY 3.0 (Au) 3.0)","For more information: https://collections.ala.org.au/public/show/dr23110","","","","632"
"in97","Unitec Institute of Technology","","Records provided by Unitec Institute of Technology, accessed through ALA website.","","For more information: https://collections.ala.org.au/public/show/in97","","","","1"
"in113","Auckland War Memorial Museum","","Records provided by Auckland War Memorial Museum, accessed through ALA website.","","For more information: https://collections.ala.org.au/public/show/in113","","","","5120"
"dr450","The Unique Flora of Tasmania","doi:10.15468/jmhbiw","J & R Coghlan, Australian Plants Society Tasmania (for images with no credit), 
images from members of APST need ""(name) Australian Plants Society Tasmania"", 
images from Chris Bell need ""Chris Bell (genus species)"".","CC-BY","For more information: https://collections.ala.org.au/public/show/dr450","","","","1"
"in114","University of Canterbury","","Records provided by University of Canterbury, accessed through ALA website.","","For more information: https://collections.ala.org.au/public/show/in114","","","","1"
"dr451","Australian Succulents","10.15468/yytveo","A&M. Kapitany, australiansucculents.com.au","CC-BY","For more information: https://collections.ala.org.au/public/show/dr451","","","","18"
"co270","FieldData / Biological Data Recording System","","Records provided by FieldData / Biological Data Recording System, accessed through ALA website.","","For more information: https://collections.ala.org.au/public/show/co270","","","","14"
"co173","Australian Antarctic Division Herbarium","","Records provided by Australian Antarctic Division Herbarium, accessed through ALA website.","","For more information: https://collections.ala.org.au/public/show/co173","","","","3"
"dr1030","Bush Heritage - Carnarvon Station Reserve","10.15468/q0dhpr","Bush Heritage Australia","CC-BY","For more information: https://collections.ala.org.au/public/show/dr1030","","","","9"
"dr366","SA Flora","10.15468/af24d8","© Crown in right of the State of South Australia, Department of Environment, Water and Natural Resources.","Creative Commons Attribution (International) (CC-BY 4.0 (Int))","For more information: https://collections.ala.org.au/public/show/dr366","- Data is supplied to ALA as held on BDBSA.
- Copies of third party datasets held by DEW are not available through SAFlora and SAFauna in ALA. 
- Information about BDBSA datasets is available through the DEW website ( http://apps.environment.sa.gov.au/emap/envmaps-query.do?cmd=su.SurveySummaryMain )","- DEW provides advice as required on restrictions to sensitive records.
- DEW perform standard filtering of BDBSA data prior to release. These standard filters include records considered questionable due to location or taxonomic issues and sub fossil records","","43194"
"dr30658","Plant specimens deposited in Osaka Museum of Natural History, Japan","10.15468/sythrh","Yokogawa M (2025). Plant specimens deposited in Osaka Museum of Natural History, Japan. National Museum of Nature and Science, Japan. Occurrence dataset https://doi.org/10.15468/sythrh accessed via GBIF.org on 2025-03-11.","CC BY","For more information: https://collections.ala.org.au/public/show/dr30658","","","","2"
"dr368","NSW BioNet Atlas","10.15468/14jd9g","BioNet Species Sightings occurrence data held by the NSW Office of Environment and Heritage (OEH).   The BioNet repository holds data from a number of sources and custodians. (Accessed through ALA Data Portal,<Date of Access>).","Creative Commons Attribution (International) (CC-BY 4.0 (Int))","For more information: https://collections.ala.org.au/public/show/dr368","","","","77140"
"dr362","Flora Atlas N.T.","10.15468/d5o7bf","Data supplied by Dept. Natural Resources, Environment, The Arts and Sport. Northern Territory of Australia","Creative Commons Attribution (Australia) (CC-BY 3.0 (Au)) Data supplied is licensed under the Creative Commons Attribution 3.0 Australia License.","For more information: https://collections.ala.org.au/public/show/dr362","","","","852"
"dr30411","Herbarium Berolinense, Berlin (B)","10.15468/dlwwhz","Botanic Garden and Botanical Museum Berlin (2023). Herbarium Berolinense, Berlin (B). Occurrence dataset https://doi.org/10.15468/dlwwhz accessed via GBIF.org on 2025-02-24.","Creative Commons Zero (CC0)","For more information: https://collections.ala.org.au/public/show/dr30411","","","","8"
"dr364","ALA species sightings and OzAtlas","10.15468/jayxmn","Individual sighting: Atlas of Living Australia (2025) Individual sighting dataset
Test sighting: Atlas of Living Australia (2025) Test sighting dataset
","CC-BY","For more information: https://collections.ala.org.au/public/show/dr364","","","","3759"
"dr360","Encyclopedia of Life Images - Flickr Group","","Citation is at the individual image","Creative Commons - license at record level (Creative Commons - license at record level)","For more information: https://collections.ala.org.au/public/show/dr360","","","","976"
"dr6975","Plants Of The Green Line - Woolsthorpe Section","10.15468/vrmvba","Plants Of The Green Line - Woolsthorpe Section (https://biocollect.ala.org.au/acsa/project/index/faefd6dd-70bb-4f66-97fb-b82b41415706)","Creative Commons Zero (CC0)","For more information: https://collections.ala.org.au/public/show/dr6975","","","","2"
"dr28226","New Zealand National Forestry Herbarium","10.15468/wwmzk6","Records provided by New Zealand National Forestry Herbarium, accessed through ALA website.","Creative Commons Attribution (International) (CC-BY 4.0 (Int))","For more information: https://collections.ala.org.au/public/show/dr28226","","","","594"
"dr30667","The Vascular Plant Collection at the Botanische Staatssammlung München","10.15468/vgr4kl","Staatliche Naturwissenschaftliche Sammlungen Bayerns. The Vascular Plant Collection at the Botanische Staatssammlung München. Occurrence dataset https://doi.org/10.15468/vgr4kl accessed via GBIF.org on 2025-03-11.","CC BY","For more information: https://collections.ala.org.au/public/show/dr30667","","","","46"
"dr30426","SP - Herbário do Estado ""Maria Eneyda P. Kaufmann Fidalgo"" - Coleção de Fanerógamas","10.15468/axlcjr","https://specieslink.net/col/1/","CC BY-NC","For more information: https://collections.ala.org.au/public/show/dr30426","","","","6"
"dr356","Littlewood Species List","10.15468/wyol5m","Paul Daves ""Littlewood","CC-BY-NC","For more information: https://collections.ala.org.au/public/show/dr356","","","","3"
"dr30421","Moscow University Herbarium (MW)","10.15468/cpnhcc","Seregin A (2025). Moscow University Herbarium (MW). Version 1.370. Lomonosov Moscow State University. Occurrence dataset https://doi.org/10.15468/cpnhcc accessed via GBIF.org on 2025-02-24.","CC BY","For more information: https://collections.ala.org.au/public/show/dr30421","","","","62"
"dr472","Annotated Atlas of the Vascular Flora of Macquarie Island - 1979","10.26179/5c64ba89e255e","Copson, G. (2010, updated 2019) Annotated Atlas of the Vascular Flora of Macquarie Island - 1979 Australian Antarctic Data Centre.","Creative Commons Attribution (International) (CC-BY 4.0 (Int)) This work is licensed under a Creative Commons Attribution (CC-BY) 4.0 License.","For more information: https://collections.ala.org.au/public/show/dr472","","","","14"
"dr474","Biology and population studies of two endemic orchid species on sub-Antarctic Macquarie Island","10.15468/ht3zeq","Australian Antarctic Data Centre. Biology and population studies of two endemic orchid species on sub-Antarctic Macquarie Island.","Creative Commons Attribution (International) (CC-BY 4.0 (Int)) This work is licensed under a Creative Commons Attribution (CC-BY) 4.0 License.","For more information: https://collections.ala.org.au/public/show/dr474","","","","15"
"dr30660","Royal Botanic Garden Edinburgh Living Plant Collections (E)","10.15468/bkzv1l","Rob Cubey (2022). Royal Botanic Garden Edinburgh Living Plant Collections (E). Royal Botanic Garden Edinburgh. Occurrence dataset https://doi.org/10.15468/bkzv1l accessed via GBIF.org on 2025-03-11.","CC BY-NC","For more information: https://collections.ala.org.au/public/show/dr30660","","","","12"
"dr16853","Port Adelaide Enfield Flora & Fauna Monitoring","10.15468/2pkvmx","Dry Creek Linear Trail bird survey: City of Port Adelaide Enfield (2025) Dry Creek Linear Trail bird survey dataset
Coastal Sand Dunes bird transect survey: City of Port Adelaide Enfield (2025) Coastal Sand Dunes bird transect survey dataset
River Torrens Linear Park 200m bird transect x 4 quadrat survey: City of Port Adelaide Enfield (2025) River Torrens Linear Park 200m bird transect x 4 quadrat survey dataset
Folland Park 100m bird transect x 4 quadrat survey: City of Port Adelaide Enfield (2025) Folland Park 100m bird transect x 4 quadrat survey dataset
Vegetation Photo-point Monitoring_Semaphore South: City of Port Adelaide Enfield (2025) Vegetation Photo-point Monitoring_Semaphore South dataset
Vegetation Photo-point Monitoring_Dry Creek: City of Port Adelaide Enfield (2025) Vegetation Photo-point Monitoring_Dry Creek dataset
Biodiversity Park - Photo-point: City of Port Adelaide Enfield (2025) Biodiversity Park - Photo-point dataset
Mutton Cove Photo-point: City of Port Adelaide Enfield (2025) Mutton Cove Photo-point dataset
Mutton Cove 200m bird transect : City of Port Adelaide Enfield (2025) Mutton Cove 200m bird transect dataset
Biodiversity Park Bird 430m Survey along path: City of Port Adelaide Enfield (2025) Biodiversity Park Bird 430m Survey along path dataset
Magazine Creek Wetlands 200m x 200m Transect: City of Port Adelaide Enfield (2025) Magazine Creek Wetlands 200m x 200m Transect dataset
Bitter Bush Blue Project: City of Port Adelaide Enfield (2025) Bitter Bush Blue Project dataset
Barker Inlet South Wetlands 200 x 200m Transect: City of Port Adelaide Enfield (2025) Barker Inlet South Wetlands 200 x 200m Transect dataset
Barker Inlet North Wetland 200m x 200m Bird Transect: City of Port Adelaide Enfield (2025) Barker Inlet North Wetland 200m x 200m Bird Transect dataset
Vegetation Photo-point Monitoring - Henry Street Swale: City of Port Adelaide Enfield (2025) Vegetation Photo-point Monitoring - Henry Street Swale dataset
South Parkway Reserve Wetlands survey: City of Port Adelaide Enfield (2025) South Parkway Reserve Wetlands survey dataset
Barker Inlet Wetland South Photo-point 1.: City of Port Adelaide Enfield (2025) Barker Inlet Wetland South Photo-point 1. dataset
Barker Inlet Wetlands South Photo-point 2.: City of Port Adelaide Enfield (2025) Barker Inlet Wetlands South Photo-point 2. dataset
Barker Inlet Wetland South Photo-point 3.: City of Port Adelaide Enfield (2025) Barker Inlet Wetland South Photo-point 3. dataset
Roy Amer Reserve and Wetland Survey: City of Port Adelaide Enfield (2025) Roy Amer Reserve and Wetland Survey dataset
Dry Creek Bird 500m Survey Transect: City of Port Adelaide Enfield (2025) Dry Creek Bird 500m Survey Transect dataset
Range Wetlands Survey: City of Port Adelaide Enfield (2025) Range Wetlands Survey dataset
","Creative Commons Attribution (Australia) (CC-BY 3.0 (Au))","For more information: https://collections.ala.org.au/public/show/dr16853","","","","1"
"co25","Northern Territory Herbarium (Darwin)","","Records provided by Northern Territory Herbarium (Darwin), accessed through ALA website.","","For more information: https://collections.ala.org.au/public/show/co25","","","","878"
"dr11049","Martin Butterfield Mallacoota Observations","10.15468/vv31t9","Martin Butterfield, Mallacoota Observations, 2019","Creative Commons Attribution (International) (CC-BY 4.0 (Int)) Martin Butterfield","For more information: https://collections.ala.org.au/public/show/dr11049","","","","126"
"dr2262","ERBG AVH data","10.15468/swmlas","Records provided by ERBG AVH data, accessed through ALA website.","Creative Commons Attribution-Noncommercial (International) (CC-BY-NC 4.0 (Int)) This work is licensed under a Creative Commons Attribution Non Commercial (CC-BY-NC) 4.0 License.","For more information: https://collections.ala.org.au/public/show/dr2262","","","","229"
"dr29495","International Barcode of Life project (iBOL)","10.15468/inygc6","The International Barcode of Life Consortium (2024). International Barcode of Life project (iBOL). Occurrence dataset https://doi.org/10.15468/inygc6 accessed via GBIF.org on 2025-02-04.","CC BY","For more information: https://collections.ala.org.au/public/show/dr29495","","","","117"
"co114","Australian Museum Malacology Collection","","Records provided by Australian Museum Malacology Collection, accessed through ALA website.","","For more information: https://collections.ala.org.au/public/show/co114","","","","2"
"dp3903","BioCollect","","Records provided by BioCollect, accessed through ALA website.","","For more information: https://collections.ala.org.au/public/show/dp3903","","","","10"
