"dr15861","NSW AVH feed","10.15468/jf3yae","Records provided by NSW AVH feed, accessed through ALA website.","Creative Commons Attribution (International) (CC-BY 4.0 (Int)) This work is licensed under a
            Creative Commons Attribution (CC-BY) 4.0 License
             .","For more information: https://collections.ala.org.au/public/show/dr15861","","","","17368"
"dp34","Department of Planning, Industry and Environment representing the State of New South Wales","","Records provided by Department of Planning, Industry and Environment representing the State of New South Wales, accessed through ALA website.","","For more information: https://collections.ala.org.au/public/show/dp34","","","","77140"
"dr15860","Centre for Australian National Biodiversity Research (CANB) AVH data","10.15468/xycuk7","Records provided by Centre for Australian National Biodiversity Research (CANB) AVH data, accessed through ALA website.","Creative Commons Attribution (International) (CC-BY 4.0 (Int)) This work is licensed under a Creative Commons Attribution (CC-BY) 4.0 License.","For more information: https://collections.ala.org.au/public/show/dr15860","","","","66808"
"co254","Dame Ella Campbell Herbarium","","Records provided by Dame Ella Campbell Herbarium, accessed through ALA website.","","For more information: https://collections.ala.org.au/public/show/co254","","","","93"
"dr21987","Victorian Conservation Seed Bank","10.15468/x2g79q","Records provided by Victorian Conservation Seed Bank, accessed through ALA website.","Creative Commons Attribution-Noncommercial (Australia) (CC-BY-NC 3.0 (Aus)) Creative Commons Attribution (International) (CC-BY 4.0 (Int) 4.0) 
        Creative Commons Attribution (International) (CC-BY 4.0 (Int) 4.0)Creative Commons Attribution (International) (CC-BY 4.0 (Int) 4.x) 
        Creative Commons Attribution-Noncommercial (Australia) (CC-BY-NC 3.0 (Aus) 3.0)","For more information: https://collections.ala.org.au/public/show/dr21987","","","","136"
"dr15867","Australian Tropical Herbarium (CNS) AVH data","10.15468/xunb57","Records provided by Australian Tropical Herbarium (CNS) AVH data, accessed through ALA website.","Creative Commons Attribution (International) (CC-BY 4.0 (Int)) This work is licensed under a Creative Commons Attribution (CC-BY) 4.0 License.","For more information: https://collections.ala.org.au/public/show/dr15867","","","","4793"
"dp32","South Australia, Department for Environment and Water","","Records provided by South Australia, Department for Environment and Water, accessed through ALA website.","","For more information: https://collections.ala.org.au/public/show/dp32","","","","43194"
"dr21986","Tasmanian Seed Conservation Centre","10.15468/czv7hg","Records provided by Tasmanian Seed Conservation Centre, accessed through ALA website.","Creative Commons Attribution (Australia) (CC-BY 3.0 (Au)) Creative Commons Attribution (Australia) (CC-BY 3.0 (Au) 3.0) 
        Creative Commons Attribution (Australia) (CC-BY 3.0 (Au) 3.0) 
        Creative Commons Attribution (Australia) (CC-BY 3.0 (Au) 3.0)","For more information: https://collections.ala.org.au/public/show/dr21986","","","","62"
"dr15866","Northern Territory Herbarium (DNA) AVH data","10.15468/e46kae","Records provided by Northern Territory Herbarium (DNA) AVH data, accessed through ALA website.","Creative Commons Attribution (International) (CC-BY 4.0 (Int)) This work is licensed under a Creative Commons Attribution (CC-BY) 4.0 License.","For more information: https://collections.ala.org.au/public/show/dr15866","","","","878"
"dr15865","AD AVH Data","10.15468/z6vaed","Records provided by AD AVH Data, accessed through ALA website.","This work is licensed under a Creative Commons Attribution (CC-BY) 4.0 License.","For more information: https://collections.ala.org.au/public/show/dr15865","","","","15493"
"dr21985","National Seed Bank","10.15468/kyg9he","Records provided by National Seed Bank, accessed through ALA website.","Creative Commons Attribution (Australia) (CC-BY 3.0 (Au)) Creative Commons Attribution (Australia) (CC-BY 3.0 (Au) 3.0)","For more information: https://collections.ala.org.au/public/show/dr21985","","","","37"
"dp30","Northern Territory Department of Environment and Natural Resources","","Records provided by Northern Territory Department of Environment and Natural Resources, accessed through ALA website.","","For more information: https://collections.ala.org.au/public/show/dp30","","","","852"
"co250","University of Canterbury Herbarium","","Records provided by University of Canterbury Herbarium, accessed through ALA website.","","For more information: https://collections.ala.org.au/public/show/co250","","","","1"
"dr15869","La Trobe University Herbarium (LTB) AVH data","10.15468/khpvn8","Records provided by La Trobe University Herbarium (LTB) AVH data, accessed through ALA website.","Creative Commons Attribution (International) (CC-BY 4.0 (Int)) This work is licensed under a Creative Commons Attribution (CC-BY) 4.0 License.","For more information: https://collections.ala.org.au/public/show/dr15869","","","","75"
"in544","Eurobodalla Regional Botanic Garden","","Records provided by Eurobodalla Regional Botanic Garden, accessed through ALA website.","","For more information: https://collections.ala.org.au/public/show/in544","","","","229"
"dr15868","James Cook University Herbarium (JCT) AVH data","10.15468/mzbw85","Records provided by James Cook University Herbarium (JCT) AVH data, accessed through ALA website.","Creative Commons Attribution (International) (CC-BY 4.0 (Int)) This work is licensed under a Creative Commons Attribution (CC-BY) 4.0 License.","For more information: https://collections.ala.org.au/public/show/dr15868","","","","113"
"dr2287","BRI AVH Data and Images","10.15468/jsffsa","Records provided by BRI AVH Data and Images, accessed through ALA website.","Creative Commons Attribution (International) (CC-BY 4.0 (Int)) This work is licensed under a Creative Commons Attribution (CC-BY) 4.0 License.","For more information: https://collections.ala.org.au/public/show/dr2287","","","","9076"
"co258","Queen Victoria Museum and Art Gallery - Invertebrates","","Records provided by Queen Victoria Museum and Art Gallery - Invertebrates, accessed through ALA website.","","For more information: https://collections.ala.org.au/public/show/co258","","","","1"
"dr7858","Advanced Ecological Knowledge and Observation System","","Each record contained in this data resource is subject to its own licence, with details included in the bibliographicCitation field. The University of Adelaide permits you to use this portal to access the data subject to the relevant licence.","Creative Commons - license at record level (Creative Commons - license at record level)","For more information: https://collections.ala.org.au/public/show/dr7858","","","","60"
"dr440","ALA website image uploads","doi:10.15468/2ed84i","Records provided by ALA website image uploads, accessed through ALA website.","CC-BY","For more information: https://collections.ala.org.au/public/show/dr440","","","","21"
"dr15870","N.C.W. Beadle Herbarium (NE) AVH data","10.15468/7t5ghf","Records provided by N.C.W. Beadle Herbarium (NE) AVH data, accessed through ALA website.","Creative Commons Attribution (International) (CC-BY 4.0 (Int)) This work is licensed under a Creative Commons Attribution (CC-BY) 4.0 License.","For more information: https://collections.ala.org.au/public/show/dr15870","","","","1939"
"dr689","NSW South Coast & ACT plants","10.15468/px2xfi","Records provided by NSW South Coast & ACT plants, accessed through ALA website.","Creative Commons Attribution (International) (CC-BY 4.0 (Int)) Don & Betty Wood","For more information: https://collections.ala.org.au/public/show/dr689","","","","522"
"co48","State Herbarium of South Australia","","Records provided by State Herbarium of South Australia, accessed through ALA website.","","For more information: https://collections.ala.org.au/public/show/co48","","","","15493"
"co49","Queensland Herbarium","","Records provided by Queensland Herbarium, accessed through ALA website.","","For more information: https://collections.ala.org.au/public/show/co49","","","","9076"
"co33","La Trobe University Herbarium","","Records provided by La Trobe University Herbarium, accessed through ALA website.","","For more information: https://collections.ala.org.au/public/show/co33","","","","75"
"co31","James Cook University Herbarium","","Records provided by James Cook University Herbarium, accessed through ALA website.","","For more information: https://collections.ala.org.au/public/show/co31","","","","113"
"co32","Kings Park and Botanic Garden","","Records provided by Kings Park and Botanic Garden, accessed through ALA website.","","For more information: https://collections.ala.org.au/public/show/co32","","","","266"
"dp20","OZCAM (Online Zoological Collections of Australian Museums) Provider","","Records provided by OZCAM (Online Zoological Collections of Australian Museums) Provider, accessed through ALA website.","","For more information: https://collections.ala.org.au/public/show/dp20","","","","27"
"dr14787","John T. Waterhouse Herbarium (UNSW) AVH data","10.15468/3r76br","Records provided by John T. Waterhouse Herbarium (UNSW) AVH data, accessed through ALA website.","Creative Commons Attribution (International) (CC-BY 4.0 (Int)) This work is licensed under a Creative Commons Attribution Non Commercial (CC-BY-NC) 4.0 License.","For more information: https://collections.ala.org.au/public/show/dr14787","","","","56"
"dr21992","The Western Australian Seed Centre (Kensington)","10.15468/yhx3en","Records provided by The Western Australian Seed Centre (Kensington), accessed through ALA website.","Creative Commons Attribution (Australia) (CC-BY 3.0 (Au)) Creative Commons Attribution (Australia) (CC-BY 3.0 (Au) 3.0) 
        Creative Commons Attribution (Australia) (CC-BY 3.0 (Au) 3.0) 
        Creative Commons Attribution (Australia) (CC-BY 3.0 (Au) 3.0)","For more information: https://collections.ala.org.au/public/show/dr21992","","","","26"
"dr21991","The Western Australian Seed Centre (Kings Park)","10.15468/kyqzzj","Records provided by The Western Australian Seed Centre (Kings Park), accessed through ALA website.","Creative Commons Attribution (Australia) (CC-BY 3.0 (Au)) Creative Commons Attribution (Australia) (CC-BY 3.0 (Au) 3.0) 
        Creative Commons Attribution (Australia) (CC-BY 3.0 (Au) 3.0) 
        Creative Commons Attribution (Australia) (CC-BY 3.0 (Au) 3.0) 
        Creative Commons Attribution (Australia) (CC-BY 3.0 (Au) 3.0) 
        Creative Commons Attribution (Australia) (CC-BY 3.0 (Au) 3.0)","For more information: https://collections.ala.org.au/public/show/dr21991","","","","870"
"co249","Auckland War Memorial Museum  Herbarium","","Records provided by Auckland War Memorial Museum  Herbarium, accessed through ALA website.","","For more information: https://collections.ala.org.au/public/show/co249","","","","5120"
"dr22285","Kings Park Botanical Gardens","10.15468/nh3vyu","Kings Park and Botanic Garden Herbarium, Botanic Gardens and Parks Authority","Creative Commons Attribution (International) (CC-BY 4.0 (Int))","For more information: https://collections.ala.org.au/public/show/dr22285","","","","266"
"dr26650","Auckland Museum Botany Collection","","Records provided by Auckland Museum Botany Collection, accessed through ALA website.","Creative Commons Attribution (International) (CC-BY 4.0 (Int))","For more information: https://collections.ala.org.au/public/show/dr26650","","","","5120"
"dr794","Weed and native flora data for the Swan Coastal Plain","10.15468/h7wbjz","Weed and native flora data for the Swan Coastal Plain","Creative Commons Attribution (International) (CC-BY 4.0 (Int)) Conditions of Access

All users need to acknowledge and agree to the following conditions before using NatureMap content:

Data within NatureMap is provided with the participation and good will of data custodians and I will endeavour, where possible, to seek a collaborative approach with custodians in any research or papers published using NatureMap data.

Re-sale of raw data or the commercial use of images or descriptive text (other than generated maps, species lists and reports) on this site is unauthorised unless written permission is obtained from the Department of Environment and Conservation (DEC).

Appropriate and full acknowledgement of DEC and species data custodians (see Data Directory) must always be given in any publication that includes data sourced here.

Data provided through NatureMap represents positive records of flora and fauna occurrence. The absence of a record should not be taken to mean flora or fauna is necessarily absent from an area. (To minimise the effect of data gaps, a buffer area should be applied that is reflective of the likelihood of surveys or collections having been undertaken in the target area.)

My username and password will not be passed on to any other person or organisation.

DEC and data custodians reserve the right to revoke registration if the above conditions of access are not complied with.

I will notify DEC if any relevant conditions change that might affect my NatureMap authorisation level.

Also note:

Custodians have kindly granted permission to allow relatively large subsets of data to be downloaded for a wide range of uses, including within a commercial context. Note, however, it is not NatureMap policy to allow the downloading of entire datasets

It is current custodian policy to only grant Advanced Access (see the Registration page) for bona fide research or conservation planning purposes. This does not extend to use within a commercial context. While this may appear restrictive, in fact basic registration provides a great deal of information on both conservation and non-conservation taxa, and all users are encouraged to explore NatureMap's sophisticated querying and mapping capabilities. DEC's Species and Communities Branch continues to provide information on detailed localities of conservation taxa to consultants and other commercial users on a fee-for-service basis.

Fair Use Guidlines

As stated above, we want as many people as possible to make use of the data available within NatureMap, so long as that use is ""fair"". It is considered fair for anyone to use information from NatureMap for conservation or planning purposes, including incorporating that information into reports or papers, or summarising and value-adding to data.

It is not considered fair use to download raw data and on-sell it. That would contravene copyright. It is also bad business, because anyone could obtain the same data directly from NatureMap.

Of particular note:

Maps, species lists, reports and raw data may be freely used by anyone, including commercial consultants, for research, planning, generating reports and compilations, or for personal use, so long as the above conditions of access are complied with.

Raw data, i.e. bulk detail records of individual locations that have been downloaded from NatureMap and not summarised, compiled or modified in any substantial way, may not be on-sold or rebadged without written permission from the Department of Environment and Conservation (DEC). This is consistent with Australian Copyright law.

Other descriptive text and images, such as Thematic content on wetlands or ecological attributes, remain the property of NatureMap and copyright holders and may not be used without written permission from DEC.

For full terms of use see Copyright page at

http://naturemap.dec.wa.gov.au/default.aspx","For more information: https://collections.ala.org.au/public/show/dr794","","","","1189"
"dr797","Whicher Scarp Flora Survey","10.15468/g9znop","Whicher Scarp Flora Survey. NatureMap: Mapping Western Australia's Biodiversity. Department of Environment and Conservation. URL: http://naturemap.dec.wa.gov.au/","Creative Commons Attribution (International) (CC-BY 4.0 (Int)) Conditions of Access

All users need to acknowledge and agree to the following conditions before using NatureMap content:

Data within NatureMap is provided with the participation and good will of data custodians and I will endeavour, where possible, to seek a collaborative approach with custodians in any research or papers published using NatureMap data.

Re-sale of raw data or the commercial use of images or descriptive text (other than generated maps, species lists and reports) on this site is unauthorised unless written permission is obtained from the Department of Environment and Conservation (DEC).

Appropriate and full acknowledgement of DEC and species data custodians (see Data Directory) must always be given in any publication that includes data sourced here.

Data provided through NatureMap represents positive records of flora and fauna occurrence. The absence of a record should not be taken to mean flora or fauna is necessarily absent from an area. (To minimise the effect of data gaps, a buffer area should be applied that is reflective of the likelihood of surveys or collections having been undertaken in the target area.)

My username and password will not be passed on to any other person or organisation.

DEC and data custodians reserve the right to revoke registration if the above conditions of access are not complied with.

I will notify DEC if any relevant conditions change that might affect my NatureMap authorisation level.

Also note:

Custodians have kindly granted permission to allow relatively large subsets of data to be downloaded for a wide range of uses, including within a commercial context. Note, however, it is not NatureMap policy to allow the downloading of entire datasets

It is current custodian policy to only grant Advanced Access (see the Registration page) for bona fide research or conservation planning purposes. This does not extend to use within a commercial context. While this may appear restrictive, in fact basic registration provides a great deal of information on both conservation and non-conservation taxa, and all users are encouraged to explore NatureMap's sophisticated querying and mapping capabilities. DEC's Species and Communities Branch continues to provide information on detailed localities of conservation taxa to consultants and other commercial users on a fee-for-service basis.

Fair Use Guidlines

As stated above, we want as many people as possible to make use of the data available within NatureMap, so long as that use is ""fair"". It is considered fair for anyone to use information from NatureMap for conservation or planning purposes, including incorporating that information into reports or papers, or summarising and value-adding to data.

It is not considered fair use to download raw data and on-sell it. That would contravene copyright. It is also bad business, because anyone could obtain the same data directly from NatureMap.

Of particular note:

Maps, species lists, reports and raw data may be freely used by anyone, including commercial consultants, for research, planning, generating reports and compilations, or for personal use, so long as the above conditions of access are complied with.

Raw data, i.e. bulk detail records of individual locations that have been downloaded from NatureMap and not summarised, compiled or modified in any substantial way, may not be on-sold or rebadged without written permission from the Department of Environment and Conservation (DEC). This is consistent with Australian Copyright law.

Other descriptive text and images, such as Thematic content on wetlands or ecological attributes, remain the property of NatureMap and copyright holders and may not be used without written permission from DEC.

For full terms of use see Copyright page at

http://naturemap.dec.wa.gov.au/default.aspx","For more information: https://collections.ala.org.au/public/show/dr797","","","","316"
"dr26642","WELT Herbarium at Museum of New Zealand Te Papa Tongarewa","10.15468/vabtex","Records provided by WELT Herbarium at Museum of New Zealand Te Papa Tongarewa, accessed through ALA website.","Creative Commons Attribution (International) (CC-BY 4.0 (Int))","For more information: https://collections.ala.org.au/public/show/dr26642","","","","4632"
"dr670","Ravensthorpe Range survey data  ","10.15468/xy591j","Ravensthorpe Range Survey Data.  NatureMap: Mapping Western Australia's Biodiversity. Department of Environment and Conservation. URL: http://naturemap.dec.wa.gov.au/
","Creative Commons Attribution (International) (CC-BY 4.0 (Int)) Conditions of Access 

All users need to acknowledge and agree to the following conditions before using NatureMap content: 

Data within NatureMap is provided with the participation and good will of data custodians and I will endeavour, where possible, to seek a collaborative approach with custodians in any research or papers published using NatureMap data. 
Re-sale of raw data or the commercial use of images or descriptive text (other than generated maps, species lists and reports) on this site is unauthorised unless written permission is obtained from the Department of Environment and Conservation (DEC). 
Appropriate and full acknowledgement of DEC and species data custodians (see Data Directory) must always be given in any publication that includes data sourced here. 
Data provided through NatureMap represents positive records of flora and fauna occurrence. The absence of a record should not be taken to mean flora or fauna is necessarily absent from an area. (To minimise the effect of data gaps, a buffer area should be applied that is reflective of the likelihood of surveys or collections having been undertaken in the target area.) 
My username and password will not be passed on to any other person or organisation. 
DEC and data custodians reserve the right to revoke registration if the above conditions of access are not complied with. 
I will notify DEC if any relevant conditions change that might affect my NatureMap authorisation level. 
Also note: 

Custodians have kindly granted permission to allow relatively large subsets of data to be downloaded for a wide range of uses, including within a commercial context. Note, however, it is not NatureMap policy to allow the downloading of entire datasets 
It is current custodian policy to only grant Advanced Access (see the Registration page) for bona fide research or conservation planning purposes. This does not extend to use within a commercial context. While this may appear restrictive, in fact basic registration provides a great deal of information on both conservation and non-conservation taxa, and all users are encouraged to explore NatureMap's sophisticated querying and mapping capabilities. DEC's Species and Communities Branch continues to provide information on detailed localities of conservation taxa to consultants and other commercial users on a fee-for-service basis. 
Fair Use Guidlines 

As stated above, we want as many people as possible to make use of the data available within NatureMap, so long as that use is ""fair"". It is considered fair for anyone to use information from NatureMap for conservation or planning purposes, including incorporating that information into reports or papers, or summarising and value-adding to data. 

It is not considered fair use to download raw data and on-sell it. That would contravene copyright. It is also bad business, because anyone could obtain the same data directly from NatureMap. 

Of particular note:

Maps, species lists, reports and raw data may be freely used by anyone, including commercial consultants, for research, planning, generating reports and compilations, or for personal use, so long as the above conditions of access are complied with. 
Raw data, i.e. bulk detail records of individual locations that have been downloaded from NatureMap and not summarised, compiled or modified in any substantial way, may not be on-sold or rebadged without written permission from the Department of Environment and Conservation (DEC). This is consistent with Australian Copyright law. 
Other descriptive text and images, such as Thematic content on wetlands or ecological attributes, remain the property of NatureMap and copyright holders and may not be used without written permission from DEC. 

For full terms of use see Copyright page at

http://naturemap.dec.wa.gov.au/default.aspx","For more information: https://collections.ala.org.au/public/show/dr670","","","","44"
"dr791","Records of the WA Seed Technology Centre","10.15468/qfmilu","Kings Park and Botanic Garden - Western Australian Seed Technology Centre","CC-BY","For more information: https://collections.ala.org.au/public/show/dr791","","","","18"
